{
  "version": "1.0.0",
  "source_intent_sha": "3554a8228b207b39a313bb0bdf6dbf2987a2a859ff60f7d8eb6fa52b64802ca0",
  "proposer": {
    "agent": "Codex",
    "transport": "cli",
    "model": "GPT-5"
  },
  "summary": "Ground the Eidolon concept around present repository evidence and identify the smallest useful experiment before project placement is decided.",
  "grounding_entries": [
    {
      "kind": "verified_fact",
      "statement": "Clarity Engine stores immutable Raw Intent revisions and exposes them through HTTP, MCP, and the browser.",
      "sources": [
        "repo:docs/vision/current_reality.md",
        "repo:app/mcp_server.py"
      ]
    },
    {
      "kind": "observation",
      "statement": "The current Eidolon packet spans identity modeling, memory, doctrine, and several related repositories, so it is broader than one executable mission.",
      "sources": [
        "intent:3554a8228b207b39a313bb0bdf6dbf2987a2a859ff60f7d8eb6fa52b64802ca0"
      ]
    },
    {
      "kind": "rejected_assumption",
      "statement": "A useful first Eidolon experiment does not require consciousness transfer or a complete theory of identity.",
      "sources": [
        "intent:3554a8228b207b39a313bb0bdf6dbf2987a2a859ff60f7d8eb6fa52b64802ca0"
      ]
    }
  ],
  "clarification_questions": [
    {
      "id": "smallest-eidolon-experiment",
      "question": "What is the smallest useful Eidolon experiment that can be evaluated without attempting consciousness transfer or full cognitive replication?"
    },
    {
      "id": "eidolon-project-placement",
      "question": "Should the first experiment live inside ACE, inside an aspirational layer, or as a separate project?"
    }
  ],
  "unresolved_gaps": [
    "The current repositories have not yet been inspected to determine whether an existing component already models reasoning patterns.",
    "The operator has not selected the first bounded Eidolon outcome."
  ],
  "created_at": "2026-06-21T23:35:00-07:00"
}
